{
  "dataset_id": "lsa.synthetic.teaching.v1",
  "name": "Synthetic Teaching and Workflow Fixtures",
  "description": "Fictional institutions and human-reviewed teaching tasks for development and evaluation setup.",
  "version": "1.0.0",
  "tenant_id": null,
  "owner": {
    "name": "Lecturer Support Agent Project",
    "authority": "Project Owner",
    "contact": null
  },
  "source": {
    "type": "synthetic",
    "uri": "https://example.invalid/lsa/synthetic",
    "snapshot_id": "DFMR-1",
    "acquired_at": "2026-07-21T10:00:00Z",
    "provenance_status": "verified"
  },
  "intended_uses": [
    "evaluation_only",
    "safety_testing_only"
  ],
  "prohibited_uses": [
    "representing fixtures as real institution data"
  ],
  "licence": {
    "status": "permission_granted",
    "identifier": "PROJECT-INTERNAL",
    "terms_uri": null,
    "copyright_holder": "Lecturer Support Agent Project",
    "commercial_use": "allowed",
    "derivatives": "allowed",
    "attribution": "Project synthetic fixture",
    "verified_at": "2026-07-21T10:00:00Z"
  },
  "classification": {
    "confidentiality": "C0_PUBLIC",
    "personal_data": "PD0_NONE",
    "assessment_security": "AS0_NOT_ASSESSMENT",
    "model_use": "MODEL_EVALUATION_ONLY"
  },
  "coverage": {
    "disciplines": [
      "engineering",
      "education",
      "business"
    ],
    "qualification_levels": [
      "diploma",
      "bachelor"
    ],
    "languages": [
      "en"
    ],
    "teaching_modalities": [
      "face_to_face",
      "online",
      "practical"
    ],
    "record_count": 0
  },
  "quality": {
    "status": "quarantined",
    "score": null,
    "reviewed_by": "pending",
    "reviewed_at": "2026-07-21T10:00:00Z",
    "limitations": [
      "No production records included"
    ],
    "contamination_checked": false
  },
  "retention": {
    "class": "PROJECT_LIFECYCLE",
    "retain_until": null,
    "legal_hold": false
  },
  "checksums": [],
  "created_at": "2026-07-21T10:00:00Z",
  "updated_at": null
}
